4","@Lizzern yep!   A grl on fb said her armwas tingling 2. but not probly not a skadet &quot;rad&quot; ... I recommended she avoid a &quot;fuktig aften&quot; :0p","fun lady gaga "Poker Face" parody: http://bit.ly/TN0Qy","3406
0","Just got back from barnes and noble I know sorry I am a book worm, got 2 books and seventeen to read after state testing this week gross","@MasonEMPTIUM I absolutly love that saying","3007
0","Just watched a Mariners game. We lost  Really want a Ichiro jersey in white or grey.","just joined twitter!","2891
4","a supr super long day ahead of me tomorrow...but looking forward to it..","is so so so so so sleepy.....","1074
0","@jojosmiles85 couldn't get it covered  hella whack. buuuut can you PUH-LEASE have a part 2 next week? i'm usually off wed/thurs!!","Hellooooo GYM! Finally decided to get ready for the fashion show that's on...FRIDAY! Ahhhhhh!","175
4","@MississippiJim best of luck to you jim","@thnetwork omg that was horrible.....","1444
4","Whenever your next to me I become silly and my imagination soars","@Lexii22 Are you okay? We'll have to talk about this tonite. Get things off your mind...i'll listen. &lt;3","3244
4","@EllenCarmack welcome to Twitter","goodnight all those on twitter.","2796
0","@taylorswift13 hey taylor do you know if there is anywhere i can watch your dateline nbc special from last night i missed it","@kassimosgood did you read angels and demons?","606
0","@MattSanders Ditto. I think my brains too wired lately  too much going on. Blah","@VideoKyle Haha, exactly! And yet I would totally live there.","3370
4","Can NOT wait to spend the enjoy the weekend!!! Can't believe it will be 1 year with the boyfriend on Tuesday!","Ugh! I hate how men play games with your mind & heart! I am totally going to live my life by the movie "he's just not that into you"","1995
4","Awsome show  made alot of friends and loved vega under fire. And new city lions and Dwof is Fuckin awsome ad shit yeaaaaaa","Wooppp http://twitpic.com/6p3pu","818
4","to  kevin nealon : hmm a trillion people hahahah want 2 chat with me  add my yahoomessenger chan_eighteen18","SURFING SURFING BLABLA :D
what 2 chat with me add me
chan_eighteen18","2886
4","@NathanFillion Right now the weather is gorgeous and looks to be all weekend. Shorts n tshirts n bbqs this weekend  It'll never last tho'!","Working hard on counting beans, making them all neater and tidier, but the time it takes is quite obscene, yet another reasons for me wa ...","2673
0","i feel sorry for hatton, guess hes just not that good.  hopefully mayweather will fare better","RaF is going good, we're moving a bit slow but its going nice","192
0","Awake and hurting","@julia_of_essex :-)","2639
4","Trying to prioritize my time. Sometimes having more time is not the issue, it's utilising that time I am finding","I just updated my Squidoo page: Making Money At Home Online - Is It Right for You? / http://tinyurl.com/c5a5ky","839
0","EXAMS TMORROW  STUDY,STUDY,STUDY!!!","going to be an interesting day..","3050
0","boyfriend is moving to colorado this fall for a year","now the fear starts to creep in","2386
4","Huge weekend for the Memorial Tournament! Enjoy the tourney BUT if you can't make it - their site rocks! www.thememorialtournament.com","We are looking for a web designer/developer to join our team at m2.  For details: http://www.m2columbus.com/webjob/m2JuniorDeveloper.pdf","3037
0","gosh i hate arguing w/ the one person you care so much about..","watchin worlds strictest parents.. psshh i'd go crazy w/ parents like these!","1890
0","A whole day of work in front of me   Cant wait for the next weekend &lt;3","Sweet 17 &lt;3 its so much better than 16 :D","3192
4","Good Morning, Twitties","2:41 a.m And Not Tired. I'm Not Surprised At All.","3522
0","@ConPunchToads Dang  That movie looked good, too.","@michaelaranda http://twitpic.com/6ffuh - Please tell me it transformed into a huge, awesome robot :D","2598
0","@oliviamunn why wont you follow me????????????????","@oliviamunn I can get you FREE golf! Anytime your in the Monterey Carmel area!","3063
4","Kickin it with my 2 favorite boys  n my girl of course. Not a bad Friday night. . Not bad at all","Getting ready for the day. .  Finally","1583
4","Good morning world  ... In a few hours my friends and I will be jumping out of a plane!","G'nite everybody :) ... i'm gonna dream about flying ... Jump Time less the 10 hours :)","733
4","Deakin is sick, Im still sore from my massage and the boys are going fishing without me. Baby &amp; i going to have a girl day together","Getting ready to go cuddle up to hubbie... hopefully we actually get to sleep in and then go out on the boat tomorrow and enjoy each other.","3282
4","@PFreeman008: If you must know, the world seems upside down when you are in Europe and I am stuck in Iowa...","Getting kitten soon! Rawr","1134
0","I wish Fallout 3 was on the PSP...but only because that's all I have with me right now","Started playing Rainbow Six Vegas today.  I can't believe I've never played this game!","194
4","@trent_reznor amazing feat! I will have 3 years oct 10. You set a great example for me. Life is better when your eyes can focus on it","lunch break. i will be glad when this day is over haha","1087
4","Went shopping. Then masjid. Now hanging with Mehreen","McDonald's and now picking up my bro and sis. Kobe Bryant- lil wayne on the radio =)","680
0","I can't believe I'm actually saying this but.... I miss physics","Oh downtown Denver... I love you.","98
4","@vene2ia She was a teacher and my swim coach at my boarding school!  This is the first time we've seen each other in 17 YEARS!!!","@costelloland  I can see you across the room was that tweet really necessary...like the laugh though!!   :)","2138
4","Too many parties tonight, stuck home. Fml.","Automatic Loveletter, I may be biased. ;-)","867
4","@SVUBuddha Aw, I just got back from visiting my 5-day-old niece, Arianna Grace.  It was a nice end to a long week - def. brightened my day","@amyjackson10  Sorry I missed you, too!  :)  TGIF!!!!","296
0","can't believe celts beat bulls","moved into my new place","2462
4","@littlelorib to me, it's weird how people &quot;don't get it&quot;.  hopefully, it'll grow on you.    Happy tomorrow.","ALL the pictures that were on my xD card have mysteriously disappeared.  ...including pics from last night....this SUCKS A$$!!!! GONE!","3188
4","@acrossoceans you are so hipster with polaroids and raybans","Today, while driving, a massive tree branch broke off of a tree and landed in the street. Right in front of me. Ouch.","1825
4","okay going to bed  tis 12.53am GOODNIGHT","@ilovesimpleplan haha yeah unlike SOMEBODY grrr :P","839
4","goodnight! cant wait till tomorrow!","aslkdjuyhs i feel so akward. :/","1919
0","I feel nauseated. I don't want to take this exam.","I suppose it's time to go to sleep. Exam tomorrow will come regardless, but I'd rather be well rested! Tweet dreams!","781
4","Cant think of anything to tweet about but i am fifteen dollars poorer  yay haha","So art walk isnt happening tonight?","1254
4","I got some of the best news tonight","Just got home from hanging out with my bestfriend and now i'm tired :)","437
4","Once again a jobb well done   http://twitpic.com/3n9y8","@mileycyrus Audi TTRS is the shit ! Pref pink :D","1957
0","Hates Conan - where is Jay Leno","is it time to go home yet?","521
4","After some Murder City Devils and Yeah Yeah Yeahs, we headed back home. And that is the story of Coachella. Goodnight!","Lupe Fiasco, Sebastian Tellier, Lykke Li, then PB&J.","1154
0","yay finally conan is back! to bad my conan watching side kick is still in london","Can't tell if i am having an amazing week or if Romy's CD is just that good! So excited for weekend  with dd, @KokoStanley and the girls","1368
0","Yes...it is Kentucky derby weekend!  Some people got to go...I was not one of them","Wishing to be in San Diego making Tortilla Soup with Michelle! I plan to take it easy this weekend...need rest..zzzz  Happy May Day to all!!","2904
4","14 daysss  better be the best frigin concert ever spent 185 on tickets!!!!!!","so happy","2934
4","home watching a movie eating ice cream","@mrolove yea hopefullyyy in like june of next year I'll be done if not earlier :)","862
4","@SpongegirlCS Heh, how did you know that's why I was so happy? Hopefully I'll be happy again shortly.","Very, very happy. Have to get dressed and go to the gym.","2092
4","Extremely exhausted but I can't sleep. Off to shop online","Changed my mind at the last minute about flying to England. I really wanted to go, but theres too much going on here for me to leave :(","370
4","What a day! Sunny start at work!","Wiki - Digital Maoism? : http://tinyurl.com/mjfsa","1110
0","@TheSims3 I would have mine installed by now but you don't support my graphic card, so not buying the game","So tired. Anaemia is wreaking havoc again.","2628
4","Went and got some cool new shoes today. Summer slip-ons  Spent the rest of the evening weeding out the garden area. Left the pumpkin plant","@whitewytch No phone number to call.  Well that's not cool.  There should always be a number to call.","1701
4","Love those days you wake up early and don't have to get up straight away","stupid neighbours appear to 1) never sleep and 2) never want me to sleep..","1742
4","@FoxyRcGrl come hang out","@alisonhaislip is there one in particular you can't get out of your head or just a montage of the library haha","2021
0","Stupid vibrating window, driving me mad, don't know how Walton copes. Can't get to make up from other bedroom: people may still be asleep","@mrsquare Pretty typical behaviour for the Grim Reaper I believe. Considerate and has a healthy digestive system.","2895
4","@celestestudio yes we all need optimism during these times.. cant give up!","J5 on showtime right now!!!!!!!","883
4","goin to bed soon. have the sats tomorrow but looking forward to tomorrow night","becca does not suck. both nick and troy do","1563
4","nothing specific, yet I was happy this weekend","I always considered my friends as my confidence boosters.. there may be something that they are seeing in me which I can't see for myself","227
4","Looking forward to playtime with my daughter (Ashley, my dog) at the park tomorrow.","...it's an up and down day today","2805
4","@AshleyOlsen7 Hey Ashley been a big fan for YEARS sine full house. looking foward to some new projects!!!","Man it is sooo nice out!:)","2609
4","work first, star gazing tonight","going star gazing tomorrow :)","2033
0","Is going leipzig berlin luton nottingham bed normality","The alternative to opeth is 
 http://twitpic.com/6ar1z","2077
4","@trent_reznor Congratulations","Pizza by Pappas Pinball Tournament! Spiderman machine. Prize pool up to $70!","2923
0","I just shed a couple of tears watching jon and kate plus 8. I hope there's no divorce in the future..or i've lost all hope in mankind.","I pretty much just broke my toe. I dropped a stupid xbox on it. Now I believe that video games are not only lame, but also very dangerous!","688
4","@TiffnyMichelle glgl","RT @RyanSeacrest I saw this on CNN and it literally brought a tear to my eye http://bit.ly/qx23z","868
0","@SavageHands your mean","@SavageHands :D","584
4","@AndrewGrill @angusbeattie Ah I see, I get the coffee and Beattie gets the beers!","@johnlacey Hey John, Print Key 2000, v5.1 is a great screen capture app, runs in the background and is always there when I need it","2640
4","got a new MP3 Player can't wait to try it out as games","Maybe I'm wrong
You decide
Shoulda been strong
Yet I lied
Nobody gets me like you","993
0","hates being awakened in the  middle of the night by a tummy ache","@gwcoffey too bad my birthday is always at a bad time. http://tinyurl.com/ld73ze","697
0","Just wake up, sun in Rome but cloudly... I think it's goin' to rain","Still raining in Rome, I go to sleep...","3456
0","Omg I'm completely in tears after watching the Medium season finale.","@ladytia She's truly an idiot.","2272
4","@MadisonMitchell you do yoga ? That's cool  I am going just about every day","@MadisonMitchell what can your loving fans do to help","2619
4","@Eyglo just finished shopping?  let me comfort ur hands  hahahahaha","@evaangelinaxxx  How about ur Sunday night?","2030
4","lazy lass as always!","when will everything be fine? just fine!!!","22
4","R @Onelovekiddo why didn't u just ask me for a hug? Lol ur always welcome to one","I can leave 3 kids from now lol","176
0","@turnblacktables ugh I keep forgetting to reply to this but YES, I AGREE","#bookpopstarcrossover The Wizzard Of Oz","2615
0","So i don't have a pet snake anymore  stupid boys.","Snowing in june? Gotta love the mountains in colorado.","906
4","Just finished watching Mrs.doubtfire","Oh I hope everyone had a good laugh...","2890
0","back in wellyz, yay (sarcasim) lol wana go back","stressing coz im gona miss my bus lol but of course theres always time to twitter :) yay the weekend is here!","2290
4","woke up early with a headache  to much wodka i guess hehehe today another party starting at 1430 pff i  dont have  energy anynmore !","@schinning wrong pic sorry","323
4","What do you hate about your iPhone? I want to help...and not just 'cause it's my job    http://www.kryptonproducts.com/","What do you hate about your iPhone? I want to help...and not just 'cause it's my job : ) http://www.kryptonproducts.com...","905
0","is over her stupid car seriously It should have been  ridden off","Had the worst sleep ever and is now getting ready to go to DFO","2452
0","up at 6:15 on a sunday morning and feeling miserable... my allergies are getting the best of me.","after a fun weekend and wayyyyy too much carnival food, i'm back in motown. :) molly was SO beautiful in the parade!","1560
4","Good morning world! Hope you had a good night! Happy 25th B-Day Tetris!","Leaving this world for a special arrangement now! :D Good night and also nice dreams! :)","1421
4","@MSirbas Bike Week...Sandusky, Ohio...Starts This Weekend and Runs Through Next Weekend, My Band is Playing There Next Saturday  HOLLA","@MarcellaAnna Ha Ha Ha, I Only Wash My Hair Like Once Every 3 Weeks :)","2463
4","@trent_reznor That's a wonderful thing Trent! happy Birthday! I'm about 2 years behind you","@DonGeronimo I'm thinking ice cream bowl","1857
0","is off to work. im so tired","bed time had a good day :)","2769
0","understands why car insurance is high in HI... my car got hit for the 3RD time in one month!","ponders why some people find it so hard to admit obvious things about themselves","1092
0","@nwjerseyliz good luck with that. I had to switch to satellite radio to find something good.","The bacone http://tinyurl.com/crh2xt","2762
0","i dont know what to do.i lost my way.help me","why everything seems to be go far away from me?","2652
4","It takes 17 Muscles to Smile &amp; 43 Muscles to Frown. So let's  today!","Fact: The creator of the Nike symbol was paid only $35 when he created it.","3419
4","Had a blast at Main Street Live in Jackson, TN tonight with our boys April Cover! Their record kicks ass, check it out","Heading to Main Street in Jackson, TN to rock and party with our boys April Cover!","1363
0","not feeling well, missing my surface training's second day  first day was actually nice...","was looking around about #openspacecode and contemplating idea of going there for a session. I am sure I can learn lot more than contribute","131
0","ed kavalee and rove mcmanus at the logies in what can only be described as formal school blazers - why? i am clearly fashion backwards","Just joined a twibe. Visit http://twibes.com/AussieTVandFilm to join","1777
4","I'm gonna punch my Head! ! ! ! ! ! ! But its going away","I saw Victoria's Vaginaaaa :) hahahah","136
0","nursing a sinus headache","oh that is the Columbia Club...spelling a problem!","3274
0","Good morning Tweets! Gotta go to work","Sweet dreams, twitterville","2103
4","Rain and dark skies over Paris. That's good: my parents won't see all the dust when they come visit","@langfordperry Strange, because I can totally hear you say it ;-)","2448
4","went swimming today! project ?? on course!","@hongyen think so... think don't need to see dr yet..","2621
0","off for a fried breakfast. then the library","wow, manny pacquiao is incredible. sad for hatton, hope he calls it a day now.","2900
0","@heatherashley29 hey...I resemble that person!","is dreadfully low tonight...","1421
0","those poor souls on that Air France flight","why don't all aircraft have GPS?","3065
4","@littlemisskhaos omg the one on mountain right? it was super packed buut ooomg so worth it  there carnitas are so bomb","mmm king taco :))","821
4","another amazing weekend.. sunflower, lexie, alice, and hayk.. thanks for an amazing night..","zomg no way!!! O_O i has nomz!!","987
0","going to bed... watching sex and the city... still depressed","studying for my final. i feel like poop","1847
4","my little white kitten is currently sleeping inside my t-shirt ..?? am i a comforter??","On my way h0me . . ^_^","496
4","House hunting, wish me luck!","@lalalizzie Well, duh. I don't need someone like you with a 5.8 GPA telling me that... :)","677
0","I've done so much research, but only have 21 words....","what was with all the police in south melbourne today?","867
4","Good Morning   Happy Monday to all!","Just kinda wondering...","3233
0","Australia's next top model time! my favs both have been eliminated dont know who to like now","helping mummy and kirsten wrap presents. then going to lunch at the surf club. yummy food. sadly my shout! grrr","188
4","is getting sleepy. Excited for tomorrow","is very surprised she made it through the day without walking out.","3425
0","It is going to be a rough day. Tomorrow is my first day back at work","Going to sleep now so that we can be on time for church this week!","1238
4","country dancing = SUPER FUN!!!","is sleeeepy. no work today :)","1318
0","I didn't sleep at all and I feel like shit.","Sleeping in the heat is possibly the worst thing ever.","1946
0","Good morning twitters!! What are your plans today?  It's a dreary day","good night everyone....That fight was so exciting it tired me out!!","3147
0","very very very very tired ..... history exam","FUCKING PIST MARDE","1405
4","just watched High School Musical with buddy Anna... good times","gettin ready for a girls night out! i love pho` yummmm","3343
4","Good Morning Twitter! Happy Monday","Feeling a bit guilty over how many shoes I just bought!","2917
4","My recording plan got cancelled. Thank God I scheduled another thing for tonight. New day plan includes watching rest 2 stargate movies.","Just watched "StarGate". Damn! I love sci-fi :D","1867
4","@mileycyrus  I wrote you a letter today, I'm a huge fan from New Zealand  http://bit.ly/eiw9t Please give it a read. u dnt hv to reply","@barneybaby you just left me on facebook...........*cries*","1320
0","Reason #749 why I hate 7News: the graphic title &quot;Hello Dalai&quot;","Charlie's beer garden http://twitpic.com/4grcv","3463
4","was in victoria this morning and tonight im in sydney.","well... im back home. :)","759
0","won netball - 2 against 14 but lost basketball - 12 against 24","with indi!","2057
4","loving the weather, looking forward to the BBQ with family","@Jemimax Yeah we went up to mote park about 2, was boiling and you will never guess who we saw, perfection is all I can say.","1761
4","@elimarienthal hi whats up","okay i gotta head to school now but i feel more like hanginh round so we'll have to see what wins in the end :)","1128
4","Celebrating my all-time favorite holiday: 4/20.","twitterpated cu' mi bestfriend arrives on tuesday. :-)","3151
4","Boarding my LAST plane in Phoenix. I'm officialy California bound","@luckyduh you can never go wrong with a Reese's ;)","2256
0","Goodmorning! need coffee to brew a little faster, but Dane is entertaining me while I wait, he looks bigger every morning","So grateful to God that He is with Cassidy and to quote a fav song...Everythings gonna be alright","1912
4","Super fun night with Jen! Stayed up way too late talking... Must get some beauty rest for the big tour tomorrow! White house anyone?!","My Daily Twittascope - http://bit.ly/mB8X3","1500
0","It sure doesn't feel like Summer here in Michigan yet. Woke up to a temp of 40 degrees! It's to warm to snowboard and too cold to bike","@KellieMcCoy yeah the 15" is perfect! Is it your first Mac?","3306
4","@HOLRENEE not anymore....but I've been known to do that in my prime...","was up at 4:30am.....zzzzzzz......might as well get in the shower....and go into work early.....yawn.....","1863
0","Damn! I Was Cupcakin Wit My Boo All Night Long! Woohoo lol. I Love that boy. Can't sleep now thou","Chillin Wit My Niqq @Pisces_Afrodite @Mcdonalds Woohoo...Food mmmm....","903
4","@katiecouric Ok, so how was it, any suprises?","@katiecouric you might be surprised, Larry King said he dated you.  True?","2821
4","@paulbradshaw I see....  Thanks for your help!","@paulbradshaw Hi! hope you have been enjoying early "British Summer" got a question: could you tell me what "#" for?","879
0","finally watched pacquiao-hatton! poor hatton  i tend to root for upper hands (ie. pacman, nadal), but feel sorry for the loser after","@quicksilver17 about what? ahaha","1633
0","@stephenfry Hurry back Norwich - the Tractor Boys will miss you","http://twitpic.com/4e4p6 - Today Ethel has four babies. Bert is attending. #fb","1350
4","Yay, new Burn Notice","Trying my hand at writing RSpec tests this morning","1087
4","Working til 5.","@bartmillard sounds like a HUGE success :)","925
4","thought the bike ride to Wales was awesome","is off for a bike ride across to Wales.","3592
0","Seems to be the one before 'the one', a new trend is emerging, DH Recently, CB, and cant forget JK. I am an unwilling cupid.  baad trend.","About to go for coffee at knox with Sam aka Black hawk.","2505
0","Alas.. the end of a long weekend.. Wonder when will the next one come..","@3Seventytwo 3 cheers to that one :)","1558
0","Fighting the urge to sleep....while driving","Is having a beer - we won!","2921
4","It's good to back to work.  Now I can get a little rest   I don't know how I managed to find a White Sox bar in Dubuque, but I did... lol","@thenadas You know I asked for "Clear"","1837
4","@eoin_macmanus cheers mate, will do - nice job btw","or this.Lazers+Stars=http://tinyurl.com/mm9les","1292
0","@brisen aw, that's a bummer  well at least you still found out about the reunion  hahah","@brisen oh definitely! Nothing Personal is gonna be epic(: I was so excited when I heard blink was back together, I screamed. No joke haha","240
0","So tired","Time for sleep! Lacking twitted updates lately! :/","1465
4","Go Sweden it's your birthday, we're gonna party like it's your birthday.. Woho, national day and football 2nite","A camera and three best friends can be a fantastic combo :) loving the pics.","1060
0","Fuck....can't sleep","@Marshadae I know it's gonna be awesome!!!","989
0","@TheDailyHerb I tried accupuncture but couldn't afford to see whether it was working at $60 a visit","I can't wait until the peacocks shut up!  They really know how to spoil the sounds of a country night.  It's late.  I'm going to read.","3230
0","@mallorygallery im soo tired but couldn't sleep late  do you wanna study for me??","@awildirishrose yeah i loved it! and we ran into jim rosko too seen the same movie at the same time, what r the odds, fun night!","1196
4","Enjoying the wonderfull weather while waiting for my train home.","Monday, a new week starts ... 8am -phone rings - seems over the weekend something in a server died... *sigh* omw to the office.","413
0","Moving upwards. And I also forgot my headphones.","I'm sorry is redemption.","1371
0","i cant believ how tired i am, i feel like falling asleep at  this very desk","Is having a little tea break with stace and coetzie :)","538
0","@lko04 why is she peeing on you? You don't look like a tree, but that's a funny visual. Poor Smellonia (your new X-Men name).","Huh- why isn't anyone tweeting now? OH RIGHT ITS 5AM. GET TO SLEEP KAELAK.","2660
4","@Schofe loving that answer - still look forward to day off! Not a complete workaholic then!! Thou me thinks twitter fills down time 2 now","@wendywings What a great idea - have stolen proudly.","1417
4","is now a fan of the Memphis Farmer's Market","is at Reagan National airport on a beautiful Sat morning, waiting to board my home flight. I just wish I'd had more sleep!","273
4","Sooo, our first game is proving to be a bit ambitious and is taking longer than either of us wants but I suppose we knew that going in","Just made a quick custom twitter BG, it will do for now.  Now to do some web design :&lt; and then hand paint some clouds for my game :&gt;","590
4","Sitting on Torry Pines beach watching the moonlight on the Pacific and listening to the waves. Relaxing","Just got my Garmin nuvi 760 GPS... It is pretty slick!","1200
0","time for another day of clinic","I'm on my way with a change of clothes. I'll be up at terrace. Text me when you're ready","1643
0","At work already  i dont wanna be here... I have all wierd people around me...","Im going to sleep...","3459
0","four C17H13ClN4 and one C16H13ClN2O... one hour later and I still can't chill out/unwind/calm down/shut down... AGH","HAHA I just tried to lay on my stomach on the hammock and totally flipped over onto the ground... hahaha - that didn't work!","1587
4","Funnnn night!! Intense ending..and dodgers won!!","Off to the dodger game!! 5 car/van loads!! Gonna have fun!","887
0","Will be missing life from tonight","Flu is in the air .... &lt;3","145
4","my girlfriend thinks twitter is stupid...i put her in her place haha","el pollo loco is nasty! haha i &lt;3 you chris.","3483
0","OIT budget paperwork.  Nothing I'd rather be doing on this beautiful.","Checking out TwitterBerry.","47
