4","is making a promotional sign for Bacon Lip Balm involving Miss Piggy. @baconsalt: How do you feel about that?","@baconvodka It's too bad we don't have a liquor license!","3311
4","@akiezz hello!  Welcome to twitter","HD video cameras are great...but storage and video editing is a huge problem......","981
4","@sakokassabian and @anidem congrats..now @anidem is a relative to me now wooottt","@ cheesecake factory with my twinn tatiana :)","2784
4","What do you hate about your iPhone? I want to help...and not just 'cause it's my job    http://www.kryptonproducts.com/","What do you hate about your iPhone? I want to help...and not just 'cause it's my job : ) http://www.kryptonproducts.com...","838
4","@jonathanrknight http://twitpic.com/4gyxw - Where is your sense of adventure??  Not even a tiny sip?  Soooo disappointed.  SIGH...","@DonnieWahlberg you can come visit me - next time you are in the UK!  USAF base RAF Lakenheath... :)","2088
4","Waking up to sunshine and woodland for miles is amazing","@KatieQuill quilly! Where you goin'?","2608
0","have got hickups and feels  cos my granddad is giving up on life","have just finished watching Big Trouble In Little China, i love that film so much","676
4","Bamboo, my pretty bamboo, growing up to 6-7 feet now.","WTH david carridine?  Shesh!","2366
4","cathing up on emails","'Magnet winner and MERMAID SALE' http://tinyurl.com/cdooex","3094
4","@calebo er,,, ok its Breaded Squid with rocket and pear salad","Having a nice rocket & pear salad with breaded calamari. http://twitpic.com/4gmai","2306
4","@prashanth_menon awesome  welcome to the club of hi fi cans","24wings later...","2348
0","Morning always comes too early... Especially when you toss and turn all night!","Bed with my man http://twitpic.com/54sle","2619
0","Deciding what to have for dinner... Would like nothing more than some mashed potato","@jpmetz YAY! are u in love with it yet?","823
4","I'm in a hot air ballooonn","@XbennygX I'm watching that too!","1150
4","@SkYoNeR Doing pretty good, just waiiiiiiiiiiiiting!!!!   How are you?  Miss ya..","Good night","1154
0","Just woke up time to do homework","waking up at 5:30 better get to sleep now","3005
0","i have been up for like 2 hours","im in trouble im an addict im addicted to this girl. shes got my heart tied in a knot and my stomach in a whirl. - cutest song ever.","2953
4","Back from Nottingham.... So proud of the driving, now absolutely shattered! Going to spend the night writing my life away  x","Only at drama school... Would you get asked, can you read a list of words for me, I need to learn your voice...","3208
4","@6CarpT77 eat waffles!  http://is.gd/QAuq","playing computer game","83
4","@DHughesy very very very funny tonight hughsey, thanks for the great laugh.","Haha looking 4ward 2hughesy's midget joke,love a good joke about those lil fellas..dwarfs, midgets, carnies... Hahathose words alone-pisser!","769
4","@Thao123 Just how did you calculate 33%? LOL. I keep myself busy. I figure life is hella short... Gotta stay awake and love what you can.","@Thao123 Hehe. Oh. I sleep 2-4 hours a night and I'm healthy. I hate sleeping. =)","3505
4","watching old eps of Cold Case online...it turn out to be a good series","Screaming...I want my chicken porridge!!!!","1715
4","@adittio  May..., Maybe Yes, Maybe No","@adittio loe kedinginan? Mmm..dusta! emg BFF nya kemane? Break up ya!???","2330
4","kareoke with a buncha hotties!","with@lukechaffin in the edit bay @Wsbtv.  future reporter, here! with his own personal producer, of course! :)","213
0","@nitrojane  I hope she's ok","it turns out it is like riding a bike","691
4","injured my foot and yet i still dance lol now im waiting for the pesentation","is getting for a big day of competition!!!","952
4","Saturday means baseball! Two of the boys have games. Little warm out here!","Headed to Komen Race at Shops at Legacy. Idle Hands playing--early this morning!","1340
4","hmm, ready 2 rock n' roll tonight &amp; great visitin' with O'Hare towin' from hit TV show &quot;Wrecked: Life in the Crash Lane&quot; on Speed Channel","heya Omaha, NE ready 2 kix this thingz off ? haha check this dude out we gotta getz him in the band www.youtube.com//v/8lGZhFrrz20&hl=en ...","1402
4","Been messing around with my blog let me know what you guys think","@ronnieledesma (you got some competition) Beat Box Champion  http://ow.ly/a7nk","2401
0","Woke up late  driving to school",""I always blow my money"","2177
4","had a good night.","Back in the big apple tomorrow! Staying with Steph till Wednesday!","1615
4","@valientthorr if theyre not fans of VT theyre no friends of mine, good or otherwise.  See you guys next go around.","red-eye reptiles smiling coke smiles...right now.","2753
0","last day of math, last night at becca's, really sad","stupid teyona, yay jordan went home, night night","2129
4","watching the logies with Demi","re-doing my wall :D","211
4","heading into the toon for a night out, woop!","mwahahaha, packing WIN. take THAT, tiny suitcase from hell! *victory dance*","1660
4","just watched Seven Pounds, omg i was crying like a baby. glorious film","fuck yes! moving house!! hahaha WAHOOOO !!!","264
4","@thepioneerwoman Thanks so much! do you know the style name and what store they came from?  I'm enjoying the chronicles of your NY trip","@thepioneerwoman -- in the red toenails pic.. what kind of shoes are those? Love them!","735
4","Got another bad sunburn, but in a few days it will just be tan  My tank top left a weird tan mark though. FARMERS TAN!!","100th tweet!!! Yay :)","3060
4","@mackeefus Yeah me too, especially now that I'm almost done.","Playing FPS games is actually an accurate simulation of being deployed, at least for me. Since that's all I do here. :) http://tr.im/kkBR","114
0","My neck hurts worse than yesterday. I can't turn it either way. Gaaaah.","This is a lot harder than I thought. Great.","2365
4","@jeffbryandavis http://twitpic.com/6b36g - Haha! Brilliant piccie! Thanks for sharing!","is very tired now, but has got a banner done yay! More tomorrow peebles! :)","1140
4","Went to the shooting range with dad, my friend Larry, and @lydiawoosley 's brother, Richard. We had a lot of fun. I like my new Glock","@BeckieHubbard who is not who you thought?","3584
4","Waiting at MemAud for the official Alpha Lambda Delta initiation ceremony. haha Getting ready to pass &quot;the flame.&quot;","Mom's Weekend at OU...one of the many perks of being a Bobcat!","1268
4","Right, I've had a few hours sleep - back to coding....","Made some good progress with TwitterHIT automation today... should go live very soon.... ;)","2069
4","fruity pebbles...so yummy.","Haha. Bekah just sat in a plate of fries","1363
0","Its 3am in the morning and i can't sleep. I don't like Jet lag","I'm getting over jet lag. but had a good night at the mulligans with friends and making your own pizza's mmmmm","3387
0","@Digitalzia Sounds like a nice way to unwind. BTW, enjoy Lipstick Jungle but don't get too attached! No more new seasons.","At breakfast with @soitscometothis at Kitchenette before he goes to work. Egg whites, smoked turkey & tomato on a homemade biscuit. Yum!","1054
0","My computer runs so loud","@travitaemorte Yeah, something like 50-60 miles, I think?","442
4","@Trouper09x blackberrys are taking over the world  conquer it","hating the weather right now :( SHITEY belfast","2277
0","can't sleep    Have to be up at 4:30 am and I'm still up","http://twitpic.com/6d3u8 -","1634
4","Getting Ready for My Daughters Ballet Recital!","The BUSY Weekend has begun....","1813
4","http://twitpic.com/6bjza - How I do it","going out with the girls tonight. :)","2554
4","@babygirlparis watching your bff re-run!! Interesting how no one could tell u were under cover! Great acting!! Smart plan","Feels really weird to pretend to not know they are looking at you when you feels their eyes starring....","364
0","@JordanCondra where are you  lol","@JordanCondra poor jordan went to see star trek 4 days ago and must have gotten lost in space! where are you! ;)","2424
0","@KassanLeavens You will all be driving before I do!  Walking? Peaceful. Memorable. Rememberable.","@KassanLeavens Are you comming to Youth tonight, Kassy?","236
0","Could anyone give me any idea why I've had a headache for 5 months? And I'm not kidding, it really has been 5 months","@PLANEFREAK_201 babes you really need to figure out your password!","3557
4","High from my Cirque Boheme performance tonight! And I get to do it again tomorrow","Teaching 2 hoop dance classes tonight and then Hoop Unit rehearsals","1457
4","good morning twitter","It's bed time for moi! :)","3195
0","Listening to someone who is talking lots of bullshit","OK,  our stand at V-ICT-OR is build up, now finishing my presentation, and putting it on our Microsoft Surface","2271
0","is up with Sarah with a sick baby. Poor girl.","is at work until 8 for some training. 12 hour day... *sigh*","789
0",":O not going holiday now","summer sooon (H) woo, Turkeey:)","3149
0","I think I pulled a glute muscle from sitting so long yesterday... And now I have a 2 hour car ride.","23.5 hours of editing (10 alone today) later, I finally have a documentary I don't completely hate.  w00t.","528
0","Last work day and overwork...So nice to be here","Sun shines again... It will be a nice Formula 1 weekend here in Istanbul..","3472
0","@typsie didn't even think about it  no emo tear! Next time for sure!","I love photo hunting dwntn after 1am!","1182
4","church, then a lotttt of studying to do. i'm so glad i'm almost done!","I think I'm calling it a night!","2925
4","it's five in the morning and i'm sitting on my bed with Dexter (@dexterkitten) listening to Puscifer! (@mjkeenan) much love to both  &lt;3&lt;3","coughing myself to death","1224
4","drag me to hell, horror-comedy.. WTF. didnt like it at all! lolol moomba was awesome 2nite!!!!!!!!!!!","Who gets a steak at greek village, eh @JePapantoniou? Haha","1982
0","cant believe we have to wait til Nov 09 for New Moon! Sadness!","@Jamiebower ... whoa! thats great stuff! :)","232
0","@vernieman 1.5.7 broke my counterstrike","off to no black tie #gmaps","531
0","Time for work.  the hangover tonight! Shit looks hilarious!!","one in the morning and I gotta wake up early.... sheeeeeit...","2470
0","Is not going to be on twitter for the weekend  noooooooo!","Yawn! Spent the whole night listening to FTSK!!! Awesome stuff though.","3218
4","@movieaddicted Nacho Libre",""I ate some bugs/I ate some grass/I use my hands/To wipe my tears..."","371
4","@NoAffiliation HOLY CRAP! i finally got around to checking out that TIT article. I remember playing that game at my mates 6th b'day party","@rosst99 dude ross noble is like my jesus!! The guy is my hero. What made you ask that anyway?","1137
0","http://twitpic.com/6od3q - It's unbelievable how much I miss The O.C","We looked like giants in the back of my grey subcompact. Fumbling to make contact. As the others slept inside","1272
4","Test GMAT scores look promising.  As long as I keep reviewing, I should do fine and be able to qualify for scholarships (if available).","Due to a loose usb port, I need to exchange my phone. No data plan for me today. I have to return to Beaumont first.","1183
4","Just got up  we fell asleep at 4. Maybe going swimming today","Is trying to stay up with crystal :)","1507
4","Summer is officially here now that I've been tanning and in a pool all in the same day","I don't want to get up. That means I have to start packing : /","3217
4","I kept getting told that I looked extra cute today, and now I just got a bed time snack! Ha-it soo works to show off my charm sometimes!","@bfiori great idea Filo! Who's with us? Let's BAN all scales from planet Earth! They weigh us wrong anyway! NO more scales! NO more scales!!","2497
4","Button badges are neat.","Im bored.  Do something. :P","1134
4","@Liz_Hatch Enjoy Europe. And when you get bored, fly over to Germany and we'll have a beer together!","@lancearmstrong Just thought about that you did not have a doping control for a longer time (longer than 3 weeks??) How unusual. ;-)","2595
0","@nicoleseitler And this surprises you? Sigh. Crazy! People are just so dang mean sometimes.","Pretty good article about the settings on your D-SLR: http://bit.ly/CfSgM","3431
4","@Lake_G I'm not so sure about that. Let's see if people still remember her next week","In bed on a sunday morning. You think how wonderful it would be  if only all of life was a sunday morning.","3118
4","We're open. It's hot outside, it's nice &amp; cool down here. Come play Biochemistry or Left 4 Dead with Josh","We is closed, guys! Stop by tomorrow at 12, we'll be closing at 10pm!","2189
0","Day at work done!! Now an hour nap then work on the door","I'm not looking forward to meetin my boss later for my telling off!!! :( I need a job","1707
0","the rain needs to die in a fire","I found a JOB......WOOT :P","3306
4","Just made cupcakes for the guys. They're out at paintball.","is so glad it's coconut coffee day.  Still trying to shake off this cold!","2074
0","@sujal great link, that qualifies as interesting.  Not sure what's worse, the story or that I'm not surprised","Trying out desk setup #2.  New 24" monitor is surprisingly complicating things.","3460
0","was dissapointed by eurovision and has literally done nothing all day. feeling ill","is upset marnie stern got cancelled. about to watch britains got talent/eurovision 8D","2485
4","Wahoo!! For sure going to be in Alaska exactly one week from today.  Can't wait","I just want the skies to clear so I can go observe =/ sigh...","1470
0","@andieonair   so sad to hear ur not on tonite","Hey Q-TWEETS..just confirmed. Q-Country is going to take some very lucky Q-listeners to meet RODNEY ATKINS at NEBRASKALAND DAYS! Stay tuned!","574
0","didnt get to make a video today  .maybe next time. Knights game was fun. we won on the last inning when we were losing the whole game! :O","Fraser's coming over. Should be fun. Making our first youtube video on CarsonAndFraser. Sub! http://www.youtube.com/user/CarsonAndFraser","714
4","@Mihnea it's all about the new attitude","o discutie interesanta despre bere pe dashboard-ul SMARK http://tinyurl.com/kw6k9l","1908
0","hopes the power doesnt go out again  thunderstorms suck when ur home alone","wants to do something funnnnnn!!!! rainy day","2187
0","just realized i haven't seen a single dunkin donuts","got his veterans plates and new license today","627
0","grilled chicken tonight 4 dinner... sadly, no pics   was too hungry &amp; it smelled too good ;)  LOL","oh yeah.... saw Star Trek w/ Buttercup... awesome!!!","2594
0","@emoney86 http://twitpic.com/5c3qk - is this your new tat? zomg....... why r u so crazy you're making me want another one","oh. about @spencerpratt & @heidimontag is because id rather follow an asshole than some dumb girl who dont know whats good for herself.SHAME","1483
4","Kudos to @ralphwilson . fantastic service to new Internet marketers. Shook his hand once in London, real gent, follow Saturday","@PPCPROZ howdy! some online community blogs for you http://is.gd/QiWW","2423
4","just back from elton - he is amazing live - he played for two and half hours with no breaks - the guy is a legend","off to elton john in a few hours :) woohoo","302
0","getting used to Depakote...SUX! Sleeping all day long!","wait a minute...the SUN!!! WHOA!","2910
4","has a question:  in a sentence or 2, how can the disconnect between home buyers and sellers be explained?  Best one gets a prize","is researching elevator pitches - http://ping.fm/JEqDc","3348
0","Is watching troy play home.... I'm so bored","I'm crazy bored!!!!","1613
0","Wow slow night on twitter.. lol I need a life","Just waiting to go to work.. Listening to http://bit.ly/VGGlk","756
0","@stefsull Well, I haven't seen it yet..","@raboof Okay thanks.","89
4","well i gave in didnt i, she got what she wanted, took ages to find the place.. over all was a good day and was worth it  xx","@cbird_182 hmm maybe :P","2934
4","Just got home from a long drive back from London. Worth it tho. Got to see my buddy H and Pink @ O2 last night! Good times!","I've come downstairs!!! :)","1989
4","@msmoss  can still read your updates","seem to be getting my baby addicted to having her bottom blasted with warm air ;)","1019
0","Juss finished watchin seris finale of mad tv","Cleveland brown from family guy is gnna have his own show!!!!!! The cleveland brown show!!!!!! Comes out in da fall hopefully :)!!!!!!!","3438
4","Just got home from a birthday","It's concerts all over town :) Wish I got to see more than two!","2320
4","Oh goodness, best graduation lunch ever. I'm sooo happy for Leah Tasha and Hunter!","Ahhh so super sleepy! Another graduation today! :)","2111
0","On my way home from the Streetcar Soiree...without a streetcar.","Hollygrove Market, fence building, Streetcar Soiree.","2206
4","Did writers' group! Encouragement abound. Nd to spend more time writing stories as other stuff. Saw dogs up for adoption. No, I didn't.","@SonyaVanSickle I've never looked at Hulu, but I like their commericials. Will need to tell me about it.","2602
4","first time ever performing an impromptu a cappella set for friends and friends of friends. So much fun.","needs a haircut. Looks very dog-like at the moment.","1476
0","never quite made the 5 miles today  4 miles will do wont it lol  maybe giv it another shot 2morrow! Bx","hey everyone. Its a shame the weather has turned! :( Heading for a run today. Going for the 5 miles i think. Fingers crossed. Bx","679
0","Sick as fuck  ;; GoodNight World.","eh... ish fuckin sick again...very shitty...&.is romaning facebook!","3563
0","visited my friends and had a great time!!! Tomorrow, up at 6:00 a.m.","Finally, taking a rest.  :)","1523
4","Ooo look, a shiny new search bar has appeared on http://iombusandrail.info","@ftr2k8 yep, late Service 1 leaves Douglas at 00:15. More info in the PDF, p3 :)","1252
4","i got out of work 2 hours early, thank you Nicole  now i have to study for my psychology test i have tomorrow morning.","wow close*","3012
4","had a time on Friday with Alice, Nicole and Amy watching Drag Me To Hell","excited for tonight :)","72
4","New phoneeee","Work 12 to 4 and then new phone!","132
4","Can't wait to finally see hannah ah","Leaving .no phone so im me .byye (:","375
0","Maan..fluff..where would the shananigans be?! Sooooo dressed to fck it up but i hav absolutely NO WHERE to go..","Fluff..we shall pop bottles for THEE BOTH OF US.. Bcuz we tha shit foo!","208
0","getting up and going to work    I need more sleep...","uk finished 5th in the eurovision song contest","1117
0","Need to get to bed go to work at 7am","Can't wait to get home from work","1030
0","at work","@tequilasam ha ha i'm going, i'm going!! Ha ha","3343
0","Read over 500 pages in school books since Tuesday. Took 7 quizzes 1 exam and did 6 assignments. Only got a 75 on my exam","@stephiejoybautz well Taffy did get a few right, but she ran out of time, i don't think she tried very hard... no puppy treat","261
4","Had a crazy night... Dont know if i wanna do that again...the last part of the night was good though","Doesnt know if she should go out tonight....hmm?","631
0","friday evening and i am tweeting","@ArchieIndian they wud become chai waalas :)","2313
0","at a dead stop on the fwy...terrible accident just ahead of us.","heading 2 Rancho for a family session, fingers r burnin' from the chilis I cut up earlier. lol","2403
0","lost my cupcake ear rings and favorite lip gloss","watching best songs of the 90's ... yah ill get to see Kurt :)","3308
0","I'm in withdrawal, cold turkey; it hurts",""When you believe they call it Rock and Roll": Have fun at the Melvins tonight everybody! And say hi to Creegan; he's doin their sound!!","1990
4","@puerhan I modified some things, but the core elements of the theme remain, yes.  Thanks!","Just finished Prison Break season 2. 3 days, 22 episodes. It is *so* good. Onward to find season 3 episodes.","2340
0","@stotter bahaha i'm sorry  and I had to work tonight...what are you doing tomorrow after 10pm?!","@stotter I'm so glad that you finally made this a note to self...any specific ones?!","1309
4","fuck yeah  lakers all the way  baby","@lazy_vLFwhat up v  what u talking bout.....","468
4","Terminator: Enough of a homage to the originals without being cheesy, and enough action to remind me why I liked them so much. Awesome.","Going to See Terminator Salvation.... Followed by Terminator Redemption, and Terminator Damnation.","1623
0","@moonfrye how about jelly beans? I like most of them but hate the licorice one","@rickcom Did you like that race Rick?  What an amazing story and victory!!!","401
4","feels elated to have finished one final  http://plurk.com/p/rm9ca","says Sunny Sunday to everyone :) http://plurk.com/p/rlcso","306
4","im rockin' the Frida Kahlo hair do according to Nigel haha","today is a relaxing stay at home kinda day :)","1610
4","Doing what I like most after a hard day @ work! Wine with Ciggie chatting to Sam E","Thinking? What does one make for a SOUL dinner party? Googling now!","2447
0","Making split pea soup tonight.  Want to get started nownowNOW, but then it'll be cold for dinner.","Ran 7.02 miles in 57 minutes, 25.0 seconds. http://voomaxer.com","515
0","Taking Back Sunday was amazing last night! Fun show with the exception that i think my nose is now broken  and my body is sore","Don't be too amazing, or I'll miss you too much...-conor O - Great lyrics by a great weird little man","3352
4","Last Xam... on 1st of June.. PC Hardware.. seems like i'hv gotta trash my system into pieces.. Kinda FuN.  - &quot;i Love iT&quot;","Xamz almost Over..!! Thinking of watz next.. any Sugesstions.??","2250
4","@graywolf So that means we have to trust what is on wikipedia now as fact instead of fiction","@SandwichINK You are welcome I hope you enjoyed the podcast","1197
0","mhm,, FloridaSunWouldBeVERYgoodRightNow, to bad i wont be there till Sept- if even that","@mileycyrus  Whoaaaa. I always thought it would be fun to be having people always taking my pictures,but thats kinda stalker'ish? lol-ily!&lt;3","203
4","@tommcfly today i was hiking and we had to make a lot of noise to scare bears away, so we sang mcfly songs.","Off to Wyoming.","1752
4","back in centrifuge, it was a good first day","having breakfast, everyone else seems to be drinking and gambling, maybe i should tell them the time..","2979
4","@logicalharmony whats the project?","@kms007 are you telling me parachute pants aren't in then?!","1853
0","Up.... alone....","So... yeah its like that around here...http://tinyurl.com/pum69k","2386
0","Wtf. I hate sleeping, i hate these nightmares","That was a super cute movie.","2587
4","@alicebates No sign yet but I only ordered it on Thurs. I did first class post though so it should be here soon. Cant contain excitement","Just spent a very rainy day in Cardiff. Bought 2 dresses, now taking my collection up to 27 dresses.","2730
0","I dont want to be going into uni on a Sunday  but i must to pass my last exam on Tuesday!","Had a wonderful day at Lynn and Peters wedding :-) Mr and Mrs Shopp! X","1701
0","On my way to do my paper round","@RealDarwinFTW Nu-night be sure to update the Staff application for when I get back.","1555
4","Having dinner at Marmalade in Bangsar with Joshie boy. Spag bol all over the place","Back yesterday from a busy week in Brunei/Miri, look forward to a really relaxing weekend. Woo hoo!","2010
0","been sick all day  watching my girlfriend playing soccer is helping though!","tweeting from a car wash! haha","895
4","@Strongsherry","@srcook Hye Kid. What have you been up to since Dallas?","3453
0","Someone who wants a tiny object at home?? I am available. Still looking for places","Omg!! I really need a home. Someone should adopt me.","3072
0","I love our cast!!!!! I am gonna miss these times","Last night :(","981
4","still figuring out this twitterness. and finding a pic for me to upload","trying out twitter app on the cell phone, not sure if it's working.","2674
4","@dannygokey http://twitpic.com/6rshi - Groovy!!!  You could be a glasses model.    Your line of eyewear will ROCK!  You're wearing Sim ...","Got a Thank You card from American Lung Assoc.  I'm honored to be part of their committee!  Do something nice 4 someone 2day - feels great!!","2103
4","@chriscornell I'd love it!  Who would not?",""whatsoever I've feared has come to life, whatsoever I've fought off became my life" and I'm so blue... grey... frozen. something's missing.","2757
4","is eating peanut m&amp;ms &lt;3 and just straightened my hair","just got out of bed, prolly gonna watch tv, doing absolutely nothing makes me happy :)","688
0","We got waaaaaaasted, 4-0. Not good","Game of soccer at 2.45, weather is _horrible_. We're gonna get drenched...and muddy....sounds ideal!","512
4","Glow in the dark bath!  and now applebees with Kendra. Yumm real food.","AHHHHH. we can hear the bands from our hotel roommm!","868
0","I dont know how to do this","i love....lamp. =]","1285
4","@rbates It's a sign for releasing more than one Railscast in a week.","Today I was reading Java Passion's course on Ruby, JRuby and Rails, well structured and informative: http://www.javapassion.com/rubyonrails/","3379
4","Ris 'n shine!","Hekje lagt seg enda :-O","920
4","Hehehe drunkenness  Good crack  Never going to try singing Dream Catch me by newton faulkner again though! Screwed it up :'(","New blog post: Minor CSS2/3 Specification Design Implementations (or hacks&hellip;) http://bit.ly/jm3rS","972
0","ALT concert... not gonna lie wasn't what I thought it would beeee... They should've played longer!!!!","@leandramacy OMGosh!! So that car alarm... Was MY parents SUV!! Lol Josh set it off when he went to sit down! Haha! I had no idea!","746
