4","Loves his mummy very very much and is so proud she won the raffle, she deserves it! You're awesome mummy i love you","http://twitpic.com/4wfyb - Is having lunch with his two favourite women; mum and granny :)","511
4","Feeling happy after a 3 hour Skype chat with my soulsister in Canada","@vincegiordano Maybe because Monday is the first day of the week :) At least here in Germany... How are you Vince? When are you moving?","1064
0","@TRIFFICVISION when u txted me I had already fallen asleep to Joe (or so I think)..I'm sorry!!!  PS: it was way after midnight ;);)","since I'm not even tired...I'm gonna chill in bed with my best friend: my iPod!!! Nightnight everyone!!","999
4","I just got home from babysitting. I made eighty dollars. NICE. I'm buying an iPod Touch Tomorrow. YES","Babysitting. These kids are little shits.","620
0","rise and shine. Time to be a slave today","@LLCOOLDAVE earthquake...y'all niggas need to bounce lol","2686
0","Awake at a something on Saturday!!! Noooo","time to go to sleep. hopefully i can wake up to a nice little car loan from my parents!","3144
0","I just don't understand immuno","the uci gunman turns out to be a paintballer","1710
0","Got new Wireless Desktop 3000. It comes with a high def laser mouse. Feels great. Wish it had higher range though","Why is that actresses who are hot in series, not hot in Wallpapers!! #Cobie Smulders","503
0","hmmm watchinf futurama bored n sad  lol","havent twittered in a long time sorry been sad i miss mr papa","188
4","home from work going to play ball with the boys from church","work in a few :)","1276
0","is greedy.","@KeliciaS @KeliciaS 

Well let's play sometime! Haha","2387
4","aah... Saddle Rack... Props to @ask4adam for being DD for the evening! Been there","GOOOOOOOOOAL!!!","515
0","if there were two things that i hate the most in the whole world it would be hot needles in my eyes and fucking driving to L.A.  sad face","i feel like i should go outside, but im scared of the sun, i've always said that the best sunblock if the roof and walls of your safe home.","2858
4","PRIDE AND PREJUDICE AND ZOMBIES IS OFFICIALY THE GREATEST BOOK I HAVE EVER READ","@SweetPotatoVine I AGRIZZLE. I THOUGHT THE MAKE A WISH SEGMENT WASN'T EVEN THAT OFFENSIVE. CERTAINLY NO WORSE THAN THE 'OSCAR BAIT' ONE.","2514
0","http://twitpic.com/5oihy - Setting my alarm. It's 1 AM now. How sad.","House all to myself for the next three days. It's party time!","2159
0","wants a laptop for her birthday. any laptop. as long as it functions. please.","@IvyO i know, me neither! :D we're awesome.","3555
0","Awake for a meeting","@marissabree Haha yes I saw it","2356
0","getting bored with what i am doing","thought i wouldn't make it today but woooohooo, it's 6 more working days to go... o_0","1982
4","Good morning twitters, rise and shine people","Good nite twitters have to get up early, :)","1207
0","had the scariest dream last night because i thought it was real","Im hoping for an awesome day tomorrow","3042
4","@beansjr heyyy Gratzies Joel! Thats awesome","Does anyone besides myself find it stupid that sleeping pills say on the label: "Warning, May cause Drowziness"?","2627
0","up w my son poor guy is sick","feeling blue!","2150
4","I can do this.  I love you all.","Happy Mother's Day. :)","125
0","@adlyman oh no id hate it if my phone was broke","@adlyman no phone?? and have a good shift hun im off to try for sleep tweet ya soon xxxx","3129
0","yay for only 4 staff on a saturday! an i forgot my memory card so no cod on me break","@CyranDorman atleast they'd give it to us straight if it were lol","579
4","Happy Mother's Day Mom! And Happy Mother's Day to all Moms!","Went to "A New Page" where they had Drum Circle 2night! Very cool, me and my girl were "Rocking in the free world". We will be @ the next 1.","3487
4","is in a hammock in the garden with a good book. A fab way to spend a stunning sunday afternoon.","is lying in bed wondering if her son will remember its Mothers Day.:)","1730
4","@tmitechnews thanks forthe help. Unjailbroken and restored successfully","read and actioned a dm via email 10 mins before it appeared in @tweetie. FAIL!","3076
0","good morning everyone,well what a horrible day today!!! dark,rainy","check out my daddys (photographer) myspace think im there too lol http://www.myspace.com/jhdodds","1836
0","early to bed","beer + home made cheeseburgers tonite yum","572
4","@leesaamarie Hi Lisa - Do you officially have the best job in the world?","Does anyone else watch the Apprentice and wonder How the F*** those morons ended up where they are??? Beggars belief...","1738
0","I'm listening to the Adam Corolla Podcast. I miss his show on KWOD.","I'm about to go to Jack's Urban eats, I'm pretty hungry, tbh. Also... go Nuggets.","1319
4","Heading to Toronto. Happy Mothers day","Excited for Toronto!","3385
4","@emmilay i just like bikes.  its fun to see what people say too haha","Also, feel free to look through my followers... I try to make sure they are normal people, and not psycho spam bots.","1638
4","@DorianAlan Hit up a party!!","Dodgers?  Can't say I watch baseball all that much :/","2883
4","jest got home from melbourne!! went 2 see me uncle n family was awsome!! went out for lunch n stuff!!","goin 2 melbourne 2 see me uncle!! should be fun! about half ways there!","2602
4","Up ungodly early on a Sunday morning and heading out to do the ride for the Heart &amp; Stroke Foundation!!","Is wondering if she's gone too far - only time will tell. :)","1536
4","Had the best day  watched my brother kick the top of the post in footy and miss from 4m out with no defence on him!! classic :p","Awsesome party @KayJay08 last night ay!! lol. I so love getting the underagers drunk!! Them and hangovers hilarious!!! Kick ass dancing :D","3418
0","Didn't get tix for the Magic games that went on sale this morning","@lancearmstrong Congrats!!!","1848
0","one day left not fair","Pool tables are so much fun","864
0","The inspirational convo with uncle made me wanna weep weep. ???????.","my office got some nb people. ~!#$@","3092
0","i have to be up in five hrs   gnyt","if your in redding, ca    come buy pozza at the pizza hut at the TA truck stop.  i got specials running all summer!!","2949
0","WHY CANT I EVER SLEEP ANYMORE. WTF. i have to get up for work in an hour","That was fucking crazy","1342
4","@MiAhni Miss MiAhni!!!    its a pleasure following you and to have you following me!  it was great meeting you at the summit!","headin' home today... i should prolly round up my stuff.","963
4","Watching the sun rise on the east coast  starscape was sick as fuck, ill be back next year for sure","Holy fuck starcape is amazing... Bassnectar just destroed it... This party is fucking sick!","226
4","Listening to Arcade Fire and feeling summery.   Tiiiight.","Three days off starting tomorrow!  I must shout it on the mountain tops!","1025
4","watching Star Trek with Jason.","Hanging with the J","2412
0","Wish I'd bought those Pink tickets now! 8 months preggers and seriously need a great night out","Soooo sleepy!","2301
4","Good morning all - Happy Mother's Day to all moms   Time for tea and exercise","Now I'm off to bed - HAPPY MOTHER'S DAY ALL - HAVE A GREAT ONE :)","1616
4","yay the hell like exam period is gonna end in less than 2 days.  super happy!","uploading some of my singings on youtube. :) so excited","117
4","Memba when?....Ahhh, Kartel did it again...He took my Yea Yea Yeaa","Good Morning.  Last nigh was very interesting.  Im glad to see my favourite star burning bright, lighting up another beautiful day. :)","971
0","Oh Icky rain go away","Goin Aquasizin wit Suey sun :) nd Whelans Tnite 4 an album launch Fun tyms yo :);)","900
0","Jackie is taking me to hospital. Real scared  wish me luck girls.","I am in so much pain. I had the tip of a hi-hat stand puncture my leg. Hurts so damn bad now I'm just lying here alone. (its been looked at)","823
4","got like 7 hours of sleep biiiitchh! goinnnng to get my haircut, then the mall and tagaaaay","omg and i didnt update my status all night either! :O","1328
0","I want to be at JavaOne next year!!!  need to find a way to fund it...mmmm!!","Will the SUN make up for havin to work on a Flash site... if not they better have long island ice-teas at the bar tonight!! :)","2594
0","Guildmate got his account hacked tonight. Changed his PW, came back on to a broke, naked char. Not a nice thing to have happen","Almost got guild Naxx Undying Achievement - failed on a KT Frost Tomb... PAINFUL!","2104
0","wow i can't receive messages","Wow! my cousin would call me to let him in the house! lol","1872
4","@john_yeo RE: Blog..oh that sounds sooo 90's!  wouldn't be easier just post up on ur facebook wall? or make Youtube channel?","@XtineSamonte what is the topic of presentation?","1161
0","The cure for insomnia is the realization that its time to wake up.!!! I'm so sleepy","I'm missing my best friend right now. I wish he was still here with me. He will always be my heart! RIP Lamar Kenneth Daniels aka PrettyBoy.","148
4","@jaschroeder It's just okay. Thanks for rubbing it in that I don't have an iPod Touch, though.","New free item: pampers coupon #2 http://tinyurl.com/qqzb5a","2845
0","Got woken up by a Woodpecker pecking on the house, couldn't fall back asleep with my poison ivy, went to find cream and stepped in poop.","...but not as beautiful as the roses Hubby got me!  :-)  http://twitpic.com/4yobn","694
4","Happy Mother's Day! What did you get your mom? I got my mom a gold ring that says mom on it. She was eyeing it at the mall.","My mom makes me so mad sometimes. But I still love her.","3507
4","@richard_bell VK's also pure evil to your insides! All that sugar and E numbers! I recommend Corona, nice &amp; light, a personal favourite","Good book - RT @MicrosoftPress: Dino Esposito's new book is "Microsoft ASP.NET and AJAX: Architecting Web Applications": http://bit.ly/Q0T","1408
0","bye beach, bye rainforest... http://twitpic.com/5on58","I love my dad, but he and I always get under each others skin when we've been around each other too long...I need more patience","1157
0","Riley Bear is 3 years old today  I hate that he's getting older","got some new shoes! yay!","1592
0","Flying back home....so soon","Shopping in sydney...such hard work ahahhaha","2098
4","is getting her crunk on with coco &amp; alzzaaaa","is thinking of her lovely garden.","45
0","i really wanna get her that ring  why couldnt i be rich","Upset cuz I can't afford the ring of her dreams. :-(","3598
4","@loyallove hey, wow!! how xciting, is that the 6th Jun signing??","Watching CI channel..."The Iceman" what a scary man he was!!! No remorse....:-(  Freaky people in the world.....sad lives....","796
0","My eye is swollen.","someone just prank phone called me. Ethan and Jason are so lame.","2651
4","Poppy is on her way home","Family lunch today.","2582
0","I have a cat hair caught in #mypenis and it's watering up and all red and puffy now.","Night night Twitter!","1527
4","8 Baptisms of the Holy Ghost at the River, it was fast, furious and on fire. Took 8 minutes..the 5 water baptisms took longer...RATS","I am thinking on this: Strength is not for STATUS, but for SERVICE mmmmmmmm I gonna Impact My World today","3517
4","is execting his parents tomorrow","Is trying qtitter on his iPhone","3390
0","hum.. Thinks i need to clean my room, badly and reread 'hes just not that into you' wat a lovely sat  lol","Ahaha messy night :) this weekend will defs mark the start of a great summer! Felt lohen today, btw! Love her so much already!","2192
0","@Rob_Kemp searched everywhere I can think of mate. And nothing","@Rob_Kemp Rich Cliff is peed off cuz it's stopped now lol","447
4","@Pink Don't forget you're interview with Rove tonight  Should be great to watch! You should move here so you can be a repeat star","@lozzyx wont it be cold at wss? LOOOOOL I'm so funny.
How was ramsay??","896
4","it's a beautiful day in the neighborhood!","is so ready for bed!! =)","837
4","now im absolutly happy","shopppppingg yeahhhh","299
4","back to ratisbon. enjoying the quiet in my apartment","nearly lunch time. I am starving!!!","528
4","@emmas80 hi..oh god it's horrible .. I  don't think I've ever had sunburn, so it's a bit of a shock to the system  how r u doing? Xx","@fountain1987 be careful the sun is hotter than it looks :) .. Yesterday I got really bad sunburn and now I have to avoid the sun LOL :( xxx","334
0","@lone_star  I want some  You guys have such good stuff down there!","D-Day, Landing at Normandy Anniversary.","2061
0","Forgot my toothbrush","I love friction vixxxen.   She has beer waiting for me!","1
4","Sat in bath with new vintage 501s and now only have wet pockets, and a lovely pair of jeans that love me","oh dear...Lions getting a mauling","1522
4","@Claire_Rybakkk dont. feel. like. shit. iloveyou!","anything, i would give up for you...","1944
4","@FoneArena waiting patiently for the chance to win the n97","@jontymisra @martin_j001 anyways im out, tired as hell from 6 hours of exam today (Level 1 CFA)","2459
4","Power outage in Stockholm. But I have twitter","just left lunch with Magnus and Viktor, former collegues from Sony Ericsson. what a nice day","2763
0","thinks its time for bed. Work tomorrow  xx","@slm725 Mmm that pie sounds soo good!! Have a slice for me and Goodnight!!xx","3521
4","Mother's Day is awesome.  Just one more reason I'm glad to be a mom!  #fb","is having a great Mother's Day!  My husband is spoiling me! :) #fb","485
4","dammnnn the work day is too long.. double people's pay and cut the hours in half.. more people will work then","bloob... bleem... blaaappp... thats the end of that!","650
4","What a great day!!! Good lovin... Good food... Did I mention the lovin???","Oh mama! Crab cakes, Parmesan encrusted tilapia, strawberry cheesecake and a mango daquiri... Too good, my friends. Feeling really spoiled!","1590
4","thank you Food Maxx.. I didn't have my ID and you let me buy that shit anyways.. The only thing gray hairs &amp; a bald spot are good for !!!","wrapped up my paperwork.. now, if MTV would just SEND THE FRIGGIN' MONEY~!!!!!!!","2718
0","Up early dealing with car issues this morning... Oy ve! I wish I knew more about cars!","Gettin my Friday follows done ahead of time!","1968
0","i am seriously hungry nd duno what to eat nd havta hav tha hous tidy fo haf6 mon morn","why do i drink. . .up sense ten ta 7. . .nd guna b fukd fo tanyt cuz prob wil not sleep today:(","1414
4","@GailR your chicken w/homemade pesto deserves homemade stuffing.  So easy to make homemade stovetop stuffing. DM me your email addy","@Dinnersforayear Amy, I was hoping they'd be a crispy ginger cookie. They're thin molasses cookies. Good but not exactly what I wanted.","1896
0","Trying my best to like twitter.... but still feel its jinXed.......?????????........","twitter ... JiNxEd.......??????????.........","2319
4","back to dhaka - oh it was a cooltastic brainstorming session at coxsbazar","crossing ctg","1358
4","so excited to turn calc books back in tomorrowww!!!","hates complex circuits &gt;:O","1550
4","Can't stop listening to this song  also lol : http://bit.ly/AUauw [youtube]","OMG!! I never tweeted while driving... lol","2355
4","Treat you mother with respect, will you!! Happy mothers Day!!","We are live right now!! Tune in to www.voiceoftruthradio.com","383
4","Remember friendship bracelets?? Peeps used to pay for my originals...now teaching my lil girl the fine art of creation and patience","Happy Mothers Day all!!!!!!!","2626
0","Ambulance and paramedics at my place in the morning, didn't bring breakfast waffles","Working on an assignment at work, sure am! I love forgetting notes when I put them aside to bring them home :(","3311
4","I spent two hours teaching a stuffed duck how to play checkers and other assorted games. Ah. The joys of having a young niece.","Why does it have to be so damn hot? I could fry chicken on the floor. I HATE FLORIDA.","1195
4","@likethedisease what time is it for you right now? It is 10:25pm for me  curiousity","Going to the mall in a half hour with court and some other people, this is gonna be great! :)","3173
0","i very very sunburnt","is bored","408
4","Joan is going to win  Nancy","HAPPY MOTHERS DAY TO ALL THE HARD WORKING MOTHERS OUT THERE. WE LOVE YOU:-)
Nancy","2800
0","Ok, so I am not going to Pune.  Will be working in the AMD Mumbai office over the weekend. Will miss the roadshow too","For those who didn't know: In the language selection at the bottom of your FaceBook page, select English: Pirate. Watch what happens...  :D","1746
0","@dwpj1 I miss you too! There r couples on board and I thought of u!","going to try and get some sleep b4 I leave!","1788
4","@calyle20 whiskey night for me.","Just saw a sign that read: NOTICE. Correctional facility. Do not stop for hitchhikers.","539
4","happy mother's day moms! bless my boys","DoIng comps in the Real Estate market...looking good!","2365
4","@sextatious13 @michbias That's not what I've heard.","Matisse's "dancing ladies" makes me so happy I want to cry.","173
4","@Time4CoffeeTime Hey that works for me, I'm game.......","Hey my friends just got in from the ocean had a great time, thank you to my new followers and I love all of you.....","3329
4","Studying for finals..  I'm so happy school ends this week, but then I only got a week off and summer school starts. Happy Mothers Day!!","Doing homework. Ugh! At least school ends in 3 weeks!!!","2043
4","Beautiful day at the park","It was well worth the wait! Waffle House here we come :)","1332
0","hoping to see my baby girl","just got off the phone with my baby girl. i cant wait to see her : *","1912
4","The Zohan is available for streaming from netflix...  I think I know what I'm doing tonight","@isleofmandan: Heh... we have 140ppl and our source is available for download.  Email is small ask to give away 10s-of-Ks hours of work.","2311
0","my internet is still wonky  sad day","beautiful view where i am at right now... makes me never want to leave Malta","965
4","&quot;Allah Kareem&quot; 2009 Album is OUT!!! RUN to the stores and BUY your copy NOW!! Album is also available too at WassoufBook.com Congrats ALL","The New 2009 Album Confirmed on 11/May/2009 :)
Thats Monday so U'd Better be the First One to Pick up a Copy before the stores Run-Out! :)","1576
4","@Debra_Cummings Amen! I have 6 dogs, 1 foster dog, and 1 cat.  I carry lint rollers everywhere!","is headed to walk the dogs and clean the city pound.","174
4","oops. i've just uploaded my new profile picture, and a new background theme. very blue","Everything Twitter - From Novice To Expert - Now available for iPhone Stanza and Kindle. Limited Offer: You set the price! http://ow.ly/67aq","806
0","I need moving boxes!!!!","Didn't realize I had so much shit...arrrghhh!!!","652
4","Dinner today is at Etta's ... Pic of the salmon for @thefishie  http://twitpic.com/4yog4","@thefishie It's gone too fast... :)
I see you found room for the mixer... Seems smaller than I thought it would be - it fits nicely :)","2912
4","still working ... I should sleep ... tomorrow will be a rough day .. coffee will be my best friend","RT @dalaoban China's Top Innovator Baidu Out-Googles Google http://ow.ly/cH1j","2249
4","Take it day by day, and nothing can go wrong.  God is SO GOOD. GOD LOVES YOU","29-16 the rockets are winning YAY","2040
4","@sammieepaige morning! where do you live again?","@sammieepaige i'm gonna go to sleeps noww. :/ talk to you laterss. :) i love youu. :D &lt;33333333333333333333333333333333333333333333333333333","3245
0","nothing soo board some body make me happy","chattting at twiiter","3192
4","is home relaxing","is wishing everyone a safe Memorial Day :-)","1686
4","going on an evening stroll.","More errands & house stuff, then calling Mom!","1741
4","Tweet tweet : can't wait for iiiiidol!! Rooting for Danny!  Ryan Seacrest ees so cuuute. My life's goal is to be his BFF","JT ON SNL WAS AMAZING. &lt;3 || S-Trek = amazing.","2629
0","My iPhone just stopped functioning because I put off upgrading it to the latest 3.0 Beta version","Bedtime Stories is a nice light hearted movie :)  Not Happy Madison's best but definitely worth watching.","1996
0","It is to early","Goin to bed.. Loves her baby more than anything","690
0","2day in not my day","meta ye5aaali9 eldawaam  ?! el waagt  ma yamshiiii !!!!!!!!!!!!!!","1473
4","The nice/cute cashier at Rubio's remembered my name. I feel super special.","@Certifiedhtchic I agree with your cousin. It's time for the UGG boots trend to DIE! LOL!","1445
4","Today was my last day at the Chart House. If you're gonna go out, go out with a bang...and quit on the busiest day of the year","I'm hung like a horse :(","2386
0","up early... on my day off.   packing for 3 days at the coast.","home and ready to get a good nights sleep...","2399
4","@rads -  my friends still bring up me fighting for marks. especially in middle school. sheesh!","Am I geeky when I say I enjoy taking notes while studying?and then realize I'll miss doing this later since I've finished my course reqs?","394
4","@DerrenLitten enjoyed the special. Shame about the sponsor!!!","Lance the Boyle in tonights #BGT","2272
0","I'm so excited but i don't no why","good luck cindy !","2778
4","@EttejNahgaem Did you have a nice sunday? I just came back from a concert.","@EttejNahgaem Hope you have a nice and peaceful sunday, Meaghan. :)","448
4","Everyone likes doing this pose, where is this pose coming from?  http://tinyurl.com/m4z3ra","DIY (season 1):You can do this in KFC http://tinyurl.com/lhvnxo","62
4","Home from mass. Putting together service project info. Finding name impossible.","thinks it really shouldn't be june already. finished another blanket today.","3004
4","IO Psychic TV project facebook account is taking off!    http://bit.ly/ubs1i  - the story is gettin out!","zapping meet the press - Anne Mulcahy, Jim Owens, and Eric Schmidt, of Google sparkled in the reflected glow of the illuminated cameras.","1487
4","Family tubing trip! Its about time!","Aidens finally asleep. Im going to bed. : )","2555
4","@BudGibson http://www.spccrossfit.com/standings We started out w/ 7 female and 24 male competitors.","@rattis Thanks! :) How'd you know?","3303
4","just arrived in dubai","still stuck at heathrow....","2747
0","realised today that i get attached to things i'd no business of getting attached to!!","this got me thinking, is it better to slow down? http://bit.ly/RDN5W","587
4","@loic Toujours en forms too","Test  http://twitpic.com/69agf","2312
4","Off work! Thank god!","Work from 11-5. :/ texts would be lovely! Have a nice dayyy&lt;3","974
0","Right - so now i'm home - what next...... Cleaning","Hooray for half days!","963
0","missing @armindo05 already","Surprise @bestisalsati with tina tasya arif","2070
0","rach got a booty call sms at 11:30pm. Feeling left out; nobody ever booty calls me at 11:30pm","@funk_e already sorted! plus, I still have some left overs from railscamp. So, hoping we'll be right :D","2159
4","working Box Office today","it's offical: i'm not sleeping tonight - just saw another mouse","1722
4","Just got out of the pool","Since my phone is about dead for good I might be getting the new Sidekick LX-Carbon :)","3273
4","Shoot was a success even if the client was two hours late.  South Philly store front looks perfect looks like I might get it by June","Photoshoot soon my clients late and scene I imagined is changing with the light *sigh* oh Well as long as there's light it'll be tight! :)","489
4","heh, sanded the back room. looked suspiciously like a powdered donut when I was done. I like manual labor.","at Brian and Molly's wedding. Molly looks fantastic. and it's a perfect day!","2462
0","Lost my voice!! bloody sux  what a great boozy weeknd,had tha best time at my mates 21st's..","sooo tired yet soooo bored!!! whos keen for lazer tag? lol","1047
0","bike is officially totalled","jason Bay... powered by whammy burger.  this is why i love sports center!","1467
4","@glass_stiletto miss you","A word to the wise ain't necessary - it's the stupid ones that need the advice.","1718
0","Damn, SourceForge is down just when I want to download The Gimp","@digi_tale Voor scholen zoals het Rits kan ik me wel voorstellen dat Google Wave nuttig kan zijn.","2530
4","@MktgExperiments Here!","RT @VOMC: Pastors: Introduce your congregation to the persecuted church http://tinyurl.com/lmy4dn","110
4","Kiana and I just picked up a poor little motherless kitten from some sherrifs at starbucks. The staff rewarded us with free drinks!","@Shadowhand no kidding. It's ridiculous.","1315
4","is loving having Peter on Twitter!","is helping Matthew study for his dreaded spelling test...not sure who is feeling more tortured.","207
0","Top 20 UK celebrities on Twitter - two new faces in the top five - but Coldplay still number one   http://bit.ly/Bp99R","Can't be at #media140 - stuck in Bulgaria unfortunately :-)","1636
4","happy to see  our blog followers growing really well   http://360.clicksuite.co.nz/","finally got my links into the blog post on Friday's talk on "The next big things" http://bit.ly/PnfaM","1211
4","making plans..... making plans","DURBAN JULY...... 1 month to go :) :) :)","3291
4","is HOME  http://plurk.com/p/z2whg","Photo: (via ssomuchlove) http://tumblr.com/xhu1z0g11","3450
0","No more believing...only praying...","Still belive... We never know....","533
4","@Nv_Corleone Thanks!  I'm hoping an ezmuze community eventually forms with people sharing songs &amp; us kicking out a bigger better ezmuze!","ezmuze+ has had 800 sales in 5 days. That's unprecedented for a Community Game! And people said it wouldn't sell at 800 MSP.","131
